{
  "$schema": "https://json-schema.org/draft/2020-12/schema",
  "$id": "urn:system-inspector:inventory-preview-binding:1",
  "title": "Internal server-held inventory preview binding (not arbitrary client input)",
  "type": "object",
  "properties": {
    "preview_id": {
      "type": "string",
      "pattern": "^[A-Za-z0-9][A-Za-z0-9_.:-]{0,127}$"
    },
    "project_id": {
      "type": "string",
      "pattern": "^[A-Za-z0-9][A-Za-z0-9_.:-]{0,127}$"
    },
    "owner_user_id": {
      "type": "string",
      "pattern": "^[A-Za-z0-9][A-Za-z0-9_.:-]{0,127}$"
    },
    "auth_version": {
      "type": "integer",
      "minimum": 1
    },
    "inventory_source_id": {
      "type": "string",
      "pattern": "^[A-Za-z0-9][A-Za-z0-9_.:-]{0,127}$"
    },
    "expected_revision": {
      "type": "integer",
      "minimum": 1
    },
    "content_sha256": {
      "type": "string",
      "pattern": "^[a-f0-9]{64}$"
    },
    "mapping_sha256": {
      "type": "string",
      "pattern": "^[a-f0-9]{64}$"
    },
    "expires_at": {
      "type": "string",
      "pattern": "^\\d{4}-\\d{2}-\\d{2}T\\d{2}:\\d{2}:\\d{2}\\.\\d{6}Z$"
    }
  },
  "required": [
    "preview_id",
    "project_id",
    "owner_user_id",
    "auth_version",
    "inventory_source_id",
    "expected_revision",
    "content_sha256",
    "mapping_sha256",
    "expires_at"
  ],
  "additionalProperties": false
}
